{
  "schema_version": "1.0.0",
  "inventory_id": "inventario-exemplo-publico-v1",
  "project_id": "projeto-demonstracao",
  "assessed_at": "2026-08-24T18:00:00-03:00",
  "catalog_revision": "terraflux-input-acquisition-catalog-1.0.0",
  "entries": [
    {
      "package_id": "SCOPE_BOUNDARY_PERMISSION",
      "status": "PARTIAL",
      "gap_class": "LEGAL_APPROVAL_MISSING",
      "evidence_refs": ["dataset/Contorno.shp", "config/exemplo_pedido_e0_dataset_atual.json"],
      "resolved_parameter_ids": ["scope.target_field_ids", "scope.allow_cross_field_work", "scope.allow_cross_property_work", "scope.cross_property_permission_status"],
      "notes": "Os talhoes demonstrativos estao identificados, mas o property_id e ilustrativo e nao ha evidencia cadastral ou permissao para continuidade entre propriedades.",
      "next_actions": ["Confirmar imovel e titularidade/arrendamento.", "Reconciliar limite operacional com SIGEF/SICAR e documento do cliente.", "Registrar permissoes por divisa, portal, geometria e acao."]
    },
    {
      "package_id": "SURVEY_VERTICAL",
      "status": "PARTIAL",
      "gap_class": "FIELD_VALIDATION_MISSING",
      "evidence_refs": ["dataset/TERRENO_LIMPO.LAZ", "dataset/derived/audit_metrics.json"],
      "resolved_parameter_ids": ["terrain.horizontal_crs"],
      "notes": "O exemplo pressupoe CRS horizontal projetado, mas nao informa datum vertical nem possui checkpoints independentes. Diferenca entre superficies derivadas da mesma fonte nao constitui acuracia absoluta.",
      "next_actions": ["Obter manifesto do voo/levantamento e transformacao vertical.", "Levantar checkpoints independentes ligados ao SGB.", "Calcular residuos e superficie de incerteza e comparar com a menor queda decisoria."]
    },
    {
      "package_id": "TERRAIN_SURFACE_CONTEXT",
      "status": "AVAILABLE_SCREENING",
      "gap_class": "FIELD_VALIDATION_MISSING",
      "evidence_refs": ["dataset/TERRENO_LIMPO.LAZ", "dataset/derived/dtm_1m.tif", "dataset/derived/slope_percent_1m.tif", "dataset/derived/contours_1m.gpkg", "dataset/derived/audit_metrics.json"],
      "resolved_parameter_ids": ["terrain.dtm_dataset_ref"],
      "notes": "O exemplo pressupoe MDT com cobertura interna completa para E0 e pontos classificados como solo; a fonte demonstrativa nao prova feicoes nao solo nem breaklines revisadas.",
      "next_actions": ["Obter classificacao original ou ortomosaico para revisar feicoes.", "Levantar estradas, cristas, fundos, valas, bueiros e canais em 3D.", "Expandir o envelope onde houver contribuicao externa."]
    },
    {
      "package_id": "AGRONOMIC_CONFIGURATION",
      "status": "PARTIAL",
      "gap_class": "PROJECT_INPUT_MISSING",
      "evidence_refs": ["config/exemplo_pedido_e0_dataset_atual.json"],
      "resolved_parameter_ids": ["agronomy.row_spacing_m"],
      "notes": "Espacamento de 1,5 m e uma hipotese E0 de baixa confianca; nao ha variedade, ciclo, arranjo por zona ou faixas de trafego confirmadas.",
      "next_actions": ["Confirmar espacamento e arranjo por zona e periodo.", "Informar variedade, corte e calendario.", "Mapear faixas de trafego existentes ou declarar que serao geradas."]
    },
    {
      "package_id": "YIELD_LOAD_EVENTS",
      "status": "MISSING",
      "gap_class": "PROJECT_INPUT_MISSING",
      "evidence_refs": [],
      "resolved_parameter_ids": [],
      "notes": "Nao existe produtividade historica, superficie P10/P50/P90, fluxo de massa calibrado ou reconciliacao com balanca.",
      "next_actions": ["Solicitar mapas e historico por talhao, variedade e corte.", "Planejar calibracao de monitor/celula contra balanca.", "Criar identidade de carga e balanco por talhao e turno."]
    },
    {
      "package_id": "SOIL_PROFILE_HYDRAULIC",
      "status": "MISSING",
      "gap_class": "PROJECT_INPUT_MISSING",
      "evidence_refs": [],
      "resolved_parameter_ids": [],
      "notes": "Nao ha zonas de solo, perfis/horizontes, textura, densidade, Ksat, infiltracao, erodibilidade, manejo ou inventario de erosoes.",
      "next_actions": ["Estratificar campanha com relevo, manejo e mapas publicos.", "Executar perfis e laboratorio por horizonte.", "Medir infiltracao/Ksat com repeticoes e estado inicial de umidade.", "Inventariar erosoes e concentracoes em campo."]
    },
    {
      "package_id": "SOIL_OPERATION_STATE",
      "status": "MISSING",
      "gap_class": "PROJECT_INPUT_MISSING",
      "evidence_refs": [],
      "resolved_parameter_ids": [],
      "notes": "Nao ha umidade correlacionada, resistencia a penetracao, precompressao, suporte ou regra de abertura/limite de carga por estado.",
      "next_actions": ["Executar piloto de penetracao com umidade simultanea.", "Medir suporte/precompressao por zona e profundidade.", "Definir estados DRY/WET/DEGRADED e politica OPEN/LOAD_LIMITED/CLOSED."]
    },
    {
      "package_id": "RAINFALL_DESIGN",
      "status": "MISSING",
      "gap_class": "CALIBRATION_MISSING",
      "evidence_refs": [],
      "resolved_parameter_ids": [],
      "notes": "Nao ha IDF selecionada, periodo de serie, dominio, periodo de retorno, duracao, hietograma, evento antecedente ou aprovacao profissional.",
      "next_actions": ["Inventariar estacoes SGB/HydroWeb/INMET proximas e representativas.", "Selecionar e versionar a IDF aplicavel.", "Aprovar eventos nominais, adversos e consecutivos por componente."]
    },
    {
      "package_id": "FULL_CATCHMENT",
      "status": "PARTIAL",
      "gap_class": "FIELD_VALIDATION_MISSING",
      "evidence_refs": ["dataset/derived/contributing_area_ha.tif", "dataset/derived/flow_direction.tif", "dataset/derived/flow_basins.tif", "dataset/derived/audit_metrics.json"],
      "resolved_parameter_ids": [],
      "notes": "Existe triagem de fluxo nao condicionado, mas o limite operacional pode receber fluxo externo. A bacia completa, entradas de borda e caminho ate receptor nao estao cobertos.",
      "next_actions": ["Usar BHO/DEM publico para descobrir montante e jusante.", "Complementar topografia ate fechar a bacia e o receptor.", "Vistoriar sete travessias/convergencias candidatas e classificar entradas de borda."]
    },
    {
      "package_id": "DRAINAGE_NETWORK",
      "status": "MISSING",
      "gap_class": "PROJECT_INPUT_MISSING",
      "evidence_refs": [],
      "resolved_parameter_ids": [],
      "notes": "Nao existe censo de carreadores, valas, canais, terracos, bueiros, CEV, secoes, receptores, obstrucao, manutencao ou caminho de falha.",
      "next_actions": ["Executar inventario censitario com fotos datadas.", "Levantar inlet/outlet e secao de cada bueiro e ativo.", "Verificar receptores, tailwater e excedencia."]
    },
    {
      "package_id": "CONSERVATION_RULE_PACK",
      "status": "PARTIAL",
      "gap_class": "CALIBRATION_MISSING",
      "evidence_refs": ["config/cenarios_conservacionistas.json", "docs/METODOS_CONSERVACIONISTAS_REGIONAIS.md", "docs/LOGICA_ESD_E_CANAL_ESCOADOURO.md"],
      "resolved_parameter_ids": [],
      "notes": "Ha taxonomia e regras conceituais, mas o exemplo nao inclui rule-pack regional executavel/aprovado para PCE, PCX, C1, C2 e C3.",
      "next_actions": ["Confirmar jurisdicao e metodo regional.", "Criar pack versionado com fonte, edicao, pagina, formula/tabela, dominio e validade.", "Calibrar PCE/PCX em dados locais e aprovar por responsavel tecnico."]
    },
    {
      "package_id": "SUBSURFACE_HYDROLOGY",
      "status": "MISSING",
      "gap_class": "PROJECT_INPUT_MISSING",
      "evidence_refs": [],
      "resolved_parameter_ids": [],
      "notes": "Nao ha piezometria sazonal, lencol, surgencias, Ksat por horizonte, qualidade da agua, descarga ou especialista responsavel.",
      "next_actions": ["Manter apenas mapa de suspeita quando houver sinal superficial.", "Executar diagnostico sazonal especializado se drenagem subsuperficial entrar no escopo."]
    },
    {
      "package_id": "FLEET_IDENTITY_GEOMETRY",
      "status": "MISSING",
      "gap_class": "PROJECT_INPUT_MISSING",
      "evidence_refs": [],
      "resolved_parameter_ids": ["fleet.operations_in_scope"],
      "notes": "O pedido declara somente FURROW com baixa confianca. Nao ha registro real de plantadora, colhedora, transbordo, caminhao, implementos, dimensoes ou composicao.",
      "next_actions": ["Inventariar frota por fabricante, modelo, serie, opcionais e configuracao.", "Coletar manual/desenho OEM.", "Medir geometria 3D e articulacoes do conjunto completo."]
    },
    {
      "package_id": "FLEET_LOAD_STABILITY",
      "status": "MISSING",
      "gap_class": "PROJECT_INPUT_MISSING",
      "evidence_refs": [],
      "resolved_parameter_ids": [],
      "notes": "Nao ha massa/carga por eixo, pneus/pressao, CG, suporte, frenagem, estabilidade ou limites aprovados por estado e superficie.",
      "next_actions": ["Pesar composicoes vazia, parcial e carregada.", "Registrar pneus/esteiras e pressoes reais.", "Definir e validar envelope de greide, estabilidade e frenagem por estado."]
    },
    {
      "package_id": "FLEET_WORK_TURN",
      "status": "MISSING",
      "gap_class": "FIELD_VALIDATION_MISSING",
      "evidence_refs": [],
      "resolved_parameter_ids": [],
      "notes": "Nao existem ensaios de raio WORK, raio TURN, offtracking, tail swing, envelope varrido, cabecira ou perfil vertical do conjunto real.",
      "next_actions": ["Desenhar protocolo seguro por movimento e estado.", "Executar ensaio GNSS do conjunto completo.", "Persistir trajetoria de cada unidade/eixo e envelope P95/maximo."]
    },
    {
      "package_id": "CONTROLLER_GUIDANCE",
      "status": "MISSING",
      "gap_class": "FIELD_VALIDATION_MISSING",
      "evidence_refs": [],
      "resolved_parameter_ids": [],
      "notes": "Nao ha modelo/display/firmware, formato, limites, comandos, round trip, simulador ou ensaio de seguimento na maquina.",